{
  "schemaVersion": "labcentral.proxmox-t3-isolation-profile/v1",
  "runID": "qualification.isolation-001",
  "targetID": "target.proxmox-t3",
  "sourceInstanceID": "instance.qualification-source-001",
  "crossInstanceID": "instance.qualification-cross-001",
  "sourceNetworkResourceID": "network.source",
  "crossNetworkResourceID": "network.cross",
  "sourceVMResourceID": "vm.source",
  "peerVMResourceID": "vm.peer",
  "crossVMResourceID": "vm.cross",
  "sourceNetworkCIDR": "10.220.0.0/24",
  "crossNetworkCIDR": "10.221.0.0/24",
  "sourceGuestIPv4": "10.220.0.10",
  "peerGuestIPv4": "10.220.0.11",
  "crossGuestIPv4": "10.221.0.10",
  "imageRepository": "labcentral/proxmox/qualification-agent",
  "imageDigest": "sha256:aaaaaaaaaaaaaaaaaaaaaaaaaaaaaaaaaaaaaaaaaaaaaaaaaaaaaaaaaaaaaaaa",
  "templateAlias": "qualification-agent",
  "storageAlias": "qualification-storage",
  "networkAlias": "qualification-network",
  "expectedVMIDs": [910001, 910002, 910003],
  "expectedVLANs": [3901, 3902],
  "cpuMillis": 2000,
  "memoryBytes": 2147483648,
  "probe": {
    "agentOrigin": "https://10.220.0.10:9443",
    "intendedPort": 22,
    "managementAddress": "10.0.0.2:8006",
    "crossInstancePort": 22,
    "attempts": 3,
    "timeoutMillis": 500
  }
}
